DEVICE ID 04d8:f453 on Bus 001 Address 060 =================
 bLength                :   0x12 (18 bytes)
 bDescriptorType        :    0x1 Device
 bcdUSB                 :  0x200 USB 2.0
 bDeviceClass           :    0x0 Specified at interface
 bDeviceSubClass        :    0x0
 bDeviceProtocol        :    0x0
 bMaxPacketSize0        :    0x8 (8 bytes)
 idVendor               : 0x04d8
 idProduct              : 0xf453
 bcdDevice              :  0x100 Device 1.0
 iManufacturer          :    0x1 KETONIX AB
 iProduct               :    0x2 Ketonix 2015
 iSerialNumber          :    0x3 201500000001
 bNumConfigurations     :    0x1
  CONFIGURATION 1: 100 mA ==================================
   bLength              :    0x9 (9 bytes)
   bDescriptorType      :    0x2 Configuration
   wTotalLength         :   0x29 (41 bytes)
   bNumInterfaces       :    0x1
   bConfigurationValue  :    0x1
   iConfiguration       :    0x0 
   bmAttributes         :   0xc0 Self Powered
   bMaxPower            :   0x32 (100 mA)
    INTERFACE 0: Human Interface Device ====================
     bLength            :    0x9 (9 bytes)
     bDescriptorType    :    0x4 Interface
     bInterfaceNumber   :    0x0
     bAlternateSetting  :    0x0
     bNumEndpoints      :    0x2
     bInterfaceClass    :    0x3 Human Interface Device
     bInterfaceSubClass :    0x0
     bInterfaceProtocol :    0x0
     iInterface         :    0x0 
      ENDPOINT 0x81: Interrupt IN ==========================
       bLength          :    0x7 (7 bytes)
       bDescriptorType  :    0x5 Endpoint
       bEndpointAddress :   0x81 IN
       bmAttributes     :    0x3 Interrupt
       wMaxPacketSize   :   0x40 (64 bytes)
       bInterval        :    0x1
      ENDPOINT 0x1: Interrupt OUT ==========================
       bLength          :    0x7 (7 bytes)
       bDescriptorType  :    0x5 Endpoint
       bEndpointAddress :    0x1 OUT
       bmAttributes     :    0x3 Interrupt
       wMaxPacketSize   :   0x40 (64 bytes)
       bInterval        :    0x1
